<?xml version="1.0" encoding="UTF-8"?>
<survey xmlns:xsi="http://www.w3.org/2001/XMLSchema-instance"
    xsi:noNamespaceSchemaLocation="survey.xsd">
    <section id="section1">
        <multiple id="Q1"/>
        <single id="Q2"/>
        <intro id="Q0"/>
    </section>
    <section id="section2">
        <intro id="Q3"/>
    </section>
    <routing ref="section1">
        <variable ref="Q0"/>
        <variable ref="Q1"/>
        <variable ref="Q3"/>
    </routing>
    <routing ref="section2">
        <variable ref="Q3"/>
    </routing>
</survey>